{
  "$schema": "language-pack.schema.json",
  "schemaVersion": 1,
  "locale": "en",
  "name": "English",
  "nativeName": "English",
  "authors": [
    "RemoteHubStudio Contributors"
  ],
  "strings": {
    "About.OpenLinkFailed": "Unable to open the link: {0}",
    "About.ProductDetails": "Version: {0}\r\nPublisher: {1}\r\nLicense: {2}\r\n{3}",
    "About.WindowTitle": "About {0}",
    "AboutForm.$this.Text": "About",
    "AboutForm._closeButton.Text": "Close",
    "AboutForm._detailsLabel.Text": "Version: —\r\nPublisher: —\r\nLicense: —\r\nCopyright: —",
    "AboutForm._header.Text": "About",
    "AboutForm._identityTitleLabel.Text": "Product information",
    "AboutForm._issuesLinkButton.Text": "Issues",
    "AboutForm._licenseLinkButton.Text": "License",
    "AboutForm._linksTitleLabel.Text": "Open source and support",
    "AboutForm._productNameLabel.Text": "Product name",
    "AboutForm._projectLinkButton.Text": "Project",
    "AboutForm._releasesLinkButton.Text": "Releases",
    "Common.Add": "Add",
    "Common.Add.Compact": "Add",
    "Common.Apply": "Apply",
    "Common.Cancel": "Cancel",
    "Common.Connect": "Connect",
    "Common.Connect.Compact": "Connect",
    "Common.Delete": "Delete",
    "Common.Delete.Compact": "Delete",
    "Common.Edit": "Edit",
    "Common.Edit.Compact": "Edit",
    "Common.Exit": "Exit",
    "Common.ListSeparator": ", ",
    "Common.More": "More",
    "Common.More.Compact": "More",
    "Common.MoreItems": "… and {0} more",
    "Common.Ok": "OK",
    "Common.Settings": "Settings",
    "Common.TopLevel": "Top level",
    "Common.Ungrouped": "Ungrouped",
    "Common.Unnamed": "(Unnamed)",
    "ConnectionEditor.Title.Add": "Add connection",
    "ConnectionEditor.Title.Edit": "Edit connection",
    "ConnectionEditor.Title.QuickConnect": "Quick connect",
    "ConnectionEditor.Validation.CustomExecutableRequired": "Custom connections require an executable path.",
    "ConnectionEditor.Validation.ManagedOption": "Option ‘{0}’ is managed in the dedicated section for the selected connection type. Change it there.",
    "ConnectionEditor.Validation.MissingTypePage": "The editor page for connection type {0} is missing.",
    "ConnectionEditor.Validation.NameRequired": "Enter a connection name.",
    "ConnectionEditor.Validation.OptionFormat": "Client options must use key=value format.",
    "ConnectionEditor.Validation.TypeOptionsInvalid": "The connection-type options are invalid.",
    "ConnectionEditorForm.$this.Text": "Add connection",
    "ConnectionEditorForm._advancedTitle.Text": "Client and advanced overrides",
    "ConnectionEditorForm._argumentsInput.PlaceholderText": "When non-empty, overrides the built-in command: <host> <port> <username> <password> <key>",
    "ConnectionEditorForm._argumentsLabel.Text": "Argument override",
    "ConnectionEditorForm._basicsTitle.Text": "Basics",
    "ConnectionEditorForm._cancelButton.Text": "Cancel",
    "ConnectionEditorForm._clientOptionsInput.PlaceholderText": "Unmodeled extensions only: one key=value pair per line; configure dedicated options above",
    "ConnectionEditorForm._clientOptionsLabel.Text": "Unmodeled options",
    "ConnectionEditorForm._executableInput.PlaceholderText": "Optional client executable override",
    "ConnectionEditorForm._executableLabel.Text": "Executable override",
    "ConnectionEditorForm._expiresLabel.Text": "Expiration date",
    "ConnectionEditorForm._expiresPicker.PlaceholderText": "No expiration",
    "ConnectionEditorForm._favoriteLabel.Text": "Favorite",
    "ConnectionEditorForm._groupLabel.Text": "Group",
    "ConnectionEditorForm._groupSelect.PlaceholderText": "No group",
    "ConnectionEditorForm._header.Text": "Add connection",
    "ConnectionEditorForm._nameInput.PlaceholderText": "For example: Production database",
    "ConnectionEditorForm._nameLabel.Text": "Name",
    "ConnectionEditorForm._notesInput.PlaceholderText": "Connection notes",
    "ConnectionEditorForm._notesLabel.Text": "Notes",
    "ConnectionEditorForm._privateKeyInput.PlaceholderText": "Optional private-key file",
    "ConnectionEditorForm._privateKeyLabel.Text": "Private key",
    "ConnectionEditorForm._saveButton.Text": "Save",
    "ConnectionEditorForm._sortOrderInput.AccessibleDescription": "Favorites first; lower values appear first. Negative values are allowed. Default: 0.",
    "ConnectionEditorForm._sortOrderLabel.Text": "Sort order",
    "ConnectionEditorForm._typeLabel.Text": "Client",
    "ConnectionEditorForm._typeSelect.PlaceholderText": "Select a client",
    "ConnectionEndpoint.AccessPassword": "Access password",
    "ConnectionEndpoint.CommandTargetPlaceholder": "Host, address, or device ID used by the command",
    "ConnectionEndpoint.DeviceId": "Device ID",
    "ConnectionEndpoint.HostPlaceholder": "Host name or IP address",
    "ConnectionEndpoint.Mode": "Mode",
    "ConnectionEndpoint.NoProtocol": "No protocol",
    "ConnectionEndpoint.Password": "Password",
    "ConnectionEndpoint.Port": "Port",
    "ConnectionEndpoint.Protocol": "Protocol",
    "ConnectionEndpoint.ProtocolPlaceholder": "Select a protocol or mode",
    "ConnectionEndpoint.Server": "Server",
    "ConnectionEndpoint.Target": "Target",
    "ConnectionEndpoint.TargetHost": "Target host",
    "ConnectionEndpoint.TransferProtocol": "Transfer protocol",
    "ConnectionEndpoint.UnsupportedLegacyValue": "Unsupported legacy value · {0}",
    "ConnectionEndpoint.Username": "Username",
    "ConnectionEndpoint.Validation.PortRange": "The selected protocol requires a port between 1 and 65535.",
    "ConnectionEndpoint.Validation.TargetControlCharacters": "The connection target cannot contain control characters.",
    "ConnectionEndpoint.Validation.TargetRequired": "Enter the host, IP address, or device ID required by this client.",
    "ConnectionEndpoint.Validation.UnsupportedProtocol": "This profile contains the unsupported legacy protocol or mode ‘{0}’. Select a value supported by the current client before saving.",
    "ConnectionOptions.Common.AutoReconnect": "Auto reconnect",
    "ConnectionOptions.Common.ColorDepth": "Color depth",
    "ConnectionOptions.Common.FullScreen": "Full screen",
    "ConnectionOptions.Custom.Title": "Custom command connection options",
    "ConnectionOptions.MobaXterm.Title": "MobaXterm connection options",
    "ConnectionOptions.Putty.Title": "PuTTY connection options",
    "ConnectionOptions.Radmin.ActionMode": "Action mode",
    "ConnectionOptions.Radmin.DisableFullKeyboardControl": "Disable full keyboard control",
    "ConnectionOptions.Radmin.Encrypt": "Encrypt",
    "ConnectionOptions.Radmin.KeyboardRestriction": "Keyboard restriction",
    "ConnectionOptions.Radmin.TargetHost": "Target host",
    "ConnectionOptions.Radmin.Title": "Radmin connection options",
    "ConnectionOptions.Radmin.UpdatesPerSecond": "Updates per second",
    "ConnectionOptions.Radmin.Validation.ColorDepth": "Select a valid Radmin color depth.",
    "ConnectionOptions.Radmin.Validation.UpdatesPerSecond": "Radmin updates per second must be between 1 and 100.",
    "ConnectionOptions.Rdp.AdministrativeSession": "Administrative session",
    "ConnectionOptions.Rdp.AdminSession": "Admin session",
    "ConnectionOptions.Rdp.AllMonitors": "All monitors",
    "ConnectionOptions.Rdp.Audio": "Audio",
    "ConnectionOptions.Rdp.Audio.Disabled": "Disable audio",
    "ConnectionOptions.Rdp.Audio.Local": "Play on this computer",
    "ConnectionOptions.Rdp.Audio.Remote": "Play on the remote computer",
    "ConnectionOptions.Rdp.CameraRedirection": "Camera redirection",
    "ConnectionOptions.Rdp.Cameras": "Cameras",
    "ConnectionOptions.Rdp.Clipboard": "Clipboard",
    "ConnectionOptions.Rdp.ClipboardRedirection": "Clipboard redirection",
    "ConnectionOptions.Rdp.ComPortRedirection": "COM-port redirection",
    "ConnectionOptions.Rdp.ComPorts": "COM ports",
    "ConnectionOptions.Rdp.Compression": "Compression",
    "ConnectionOptions.Rdp.Computer": "Computer",
    "ConnectionOptions.Rdp.ConnectionBar": "Connection bar",
    "ConnectionOptions.Rdp.DesktopHeight": "Desktop height",
    "ConnectionOptions.Rdp.DesktopWidth": "Desktop width",
    "ConnectionOptions.Rdp.DisableWallpaper": "Disable wallpaper",
    "ConnectionOptions.Rdp.DisplayConnectionBar": "Display connection bar",
    "ConnectionOptions.Rdp.DriveRedirection": "Drive redirection",
    "ConnectionOptions.Rdp.Drives": "Drives",
    "ConnectionOptions.Rdp.EnableCompression": "Enable compression",
    "ConnectionOptions.Rdp.Keyboard.FullScreenOnly": "On the remote computer in full-screen mode",
    "ConnectionOptions.Rdp.Keyboard.Local": "On this computer",
    "ConnectionOptions.Rdp.Keyboard.Remote": "On the remote computer",
    "ConnectionOptions.Rdp.KeyboardHook": "Keyboard hook",
    "ConnectionOptions.Rdp.Microphone": "Microphone",
    "ConnectionOptions.Rdp.MicrophoneRedirection": "Microphone redirection",
    "ConnectionOptions.Rdp.PosDeviceRedirection": "POS-device redirection",
    "ConnectionOptions.Rdp.PosDevices": "POS devices",
    "ConnectionOptions.Rdp.PrinterRedirection": "Printer redirection",
    "ConnectionOptions.Rdp.Printers": "Printers",
    "ConnectionOptions.Rdp.PromptForCredentials": "Prompt for credentials when connecting",
    "ConnectionOptions.Rdp.RemoteAudio": "Remote audio",
    "ConnectionOptions.Rdp.SmartCardRedirection": "Smart-card redirection",
    "ConnectionOptions.Rdp.SmartCards": "Smart cards",
    "ConnectionOptions.Rdp.Title": "RDP connection options",
    "ConnectionOptions.Rdp.Validation.DesktopHeight": "RDP desktop height must be between 200 and 16384.",
    "ConnectionOptions.Rdp.Validation.DesktopWidth": "RDP desktop width must be between 320 and 16384.",
    "ConnectionOptions.Rdp.WindowsKeyCombinations": "Windows key combinations",
    "ConnectionOptions.RustDesk.ConnectionMode": "Connection mode",
    "ConnectionOptions.RustDesk.ForceRelay": "Force relay",
    "ConnectionOptions.RustDesk.OneTimePassword": "One-time password",